"","title","url_val","contentlist"
"1","텔레그램 사용처..","http://www.clien.net/service/board/park/14746757?od=T31&po=0&category=&groupCd=community","																																																															      최근 3년간 샤오미폰만 3대를 사용했는데 (미6, 미A2, 홍미노트5)   샤오미 커펌 개발자들이 대부분 중국 러시아 독일 사람들이라 그런지, 텔레그램을 통한 개발 자료 공유가 활발히 이루어지더라구요..    최근들어 텔레그램 인식이 망이되어서 마음아픕니다   																			"
"2","주식 오늘 하루에 35% 낙폭 차이 진짜 개인은 하지 마세요.","http://www.clien.net/service/board/park/14746755?od=T31&po=0&category=&groupCd=community","																										      시초가 -5% 에 시작해서 오늘도 죽을 쓸까 싶었는데 그걸 오전에 말아 올려서 오후에 외국인 천억대 이상 매수세가 들어오면서 이 떡락장에 상한가에 근접했네요. 하루에 낙폭이 35% 억대 투자금이라 일이 손에 잡히지가 않는군요.&nbsp;   																			"
"3","엠팍은 입국금지 프레임 아직도 붙들고 있네요..","http://www.clien.net/service/board/park/14746754?od=T31&po=0&category=&groupCd=community","																										         처음에 ""중국 안막아서 망했다"" 프레임으로 거세게 몰아부치다,      이탈리아를 시작으로 유럽 팬데믹 시작, 그 와중에 외신칭찬이 이어지자,      일베발 왜곡,날조 자료 가져와서 &nbsp;""문천지들이 외신 날조했다""며 오히려 역공      그와중에 외신의 칭찬이 그칠줄 모르고 지속되자 이번엔      ""정부가 잘한게 아니라, 의사들이 희생해서 잘한거다, 정부가 한게뭐냐? "" 프레임..      현재는 홍혜걸의 논지를 신봉하며,      ""무상의료가 유럽을 망쳤다, 한국도 공공의료 고집하면 유럽꼴 못면할것"" 이거 밀고 있습니다..      '의료 민영화'를 추진하려는 작전세력이 침투한게 확실해 보입니다.      거기에 더해 현재도 이미 갓끈 떨어진지 오래인 '입국금지' 프레임 아직도 밀고 있네요      지금이라도 입국금지해야 된다고.... &nbsp;문재X 뭐하냐고..      지금 입국자 90%가 자국민인데 이걸 막으라고???            																			"
"4","월요일엔 로또 당첨 확인.jpg","http://www.clien.net/service/board/park/14746753?od=T31&po=0&category=&groupCd=community","																																																															               오전에 바빴어서 이제야 보는데.. 계속 바빠야겠어요 ;;      																			"
"5","7광구는 일본으로 넘어 갈 확률이 높네요","http://www.clien.net/service/board/park/14746752?od=T31&po=0&category=&groupCd=community","																										            어릴 때 교과서에서 본 기억이 가물가물 나는데...&nbsp;      최근에 KBS '시사기획 창' 에서 다뤄서 보니..      원래 대륙붕 기준으로 한국이 우리 땅(바다)라고 개발하려고 했는데 일본이 같이 할래? 했다가 그래 돈도 없고 기술도 없는데      갈이 알아보자 해서 알아보다가 그 사이 국제법이 대륙붕 기준에서 EEZ로 바뀌면서 일본이 미래에 냅두면 꿀꺽 할수 있을거 같으니      경제성 없어서 덮자고 조약 맺고 43년전 묵히는중... 근데 바로 옆에 중국쪽 바다에서 석유랑 가스가 펑펑 터지는거 보니 분명      여기도 석유랑 가스가 펑펑 날거 같은데 조약때문에 개발을 못하고 있군요. 이대로 가면 8년뒤 조약 끝나고 일본이 EEZ 주장하면      남한만한 바다가 일본으로 귀속된다고 하네요.      이건 쌍방 조약을 맺은거라서 일본입장에서 한국이 떼쓰는 거라고 주장해도 할말이 없는 상태군요...      현재 일본측에 우리 개발할거임 통보하고 허가를 기다리는 중인데 일본이 허가해줄리 만무하다고 하네요.      심지어 우리가 개발비 다 낸다고 하는데도 일본이 경제성 없다는 핑계로 시간끌기 시전중 ㄷㄷ      암튼 경제성은 핑계고 일본이 다 먹을려는 시간끌기네요... 조약을 맺을때 신중하게 봤어야 했는데... 이건 뭐... 좀 힘들어 보이네요.      현실적인건 일본도 중국이랑 공동개발 할려고 하던데 중국을 잘 꼬드겨서? 일본이랑 중국사이에서 우리가 줄 잘타는 게 답인거 같군요..&nbsp;   																			"
"6","'유서 잠적' 김원성 '용기내 싸울것' 무소속 출마 시사","http://www.clien.net/service/board/park/14746751?od=T31&po=0&category=&groupCd=community","																										      김 최고위원은 이날 페이스북에서 “나타나지도 않는 미투, 그리고 제 목소리가 담기지 않은 녹취록, 그간 저를 끊임없이 흔들었던 당 관계자들의 광란에 가까운 움직임에 멘탈이 붕괴돼 순간적으로 가족과 부모님께 씻지못할 큰 상처를 드린것 같아 송구하다”고 했다. 그는 “일평생 부끄러운 짓을 하지 않았고, 조그만 징계조차 받은 일이 없다”며 “한 사람의 인생을 그리고 한 가족을 자신의 명분과 이익을 위해 사지로 몰아넣은 세력의 실체를 반드시 밝혀내 명예를 회복하겠다”라고 했다. 또 “진영에 얽매이지 않고 국민만을 바라보고 정의의 길에 서는 좋은 정치인이 되겠다”라고 했다. 정치권에선 “무소속 출마를 통해 명예를 회복하겠다는 것 아니냐”는 말이 나왔다.&nbsp;      -----------------------------------------------------------------------------------------------------------------------------------------------------------------------------------------------------   부산 북 강서을이 쉽지 않은 동네이긴 하지만..   더불어민주당에서 spec 어마어마한 최지은 후보를 공천한다데가   현역인 김도읍에, 전 부산 강서구청장 출신의 강인길 무소속 출마, 김원성 무소속 출마하면서 해볼만 하지 않을까? 싶네요.      출처는 조선일보이니 클릭하지마세요~   																			"
"7","섬나라","http://www.clien.net/service/board/park/14746750?od=T31&po=0&category=&groupCd=community","																										      ""더 많은 가족들이 사랑하는 사람을 잃을 것입니다.""라며 영국 총리가 실상 코로나 대응 포기를 선언 했죠.   대책으로 집단면역체계구축으로 감염자 수를 줄이는 방법을 내 놓았는데 이게 전 국민의 60%가 감영되어 면역력을 갖게 되면 자연히 감영자가 감소할 거라는 얘기였죠.&nbsp;      물론 26만명이 사망할거라는 연구결과 때문인지 실행은 하지않고 180도 바꿔 감염을 억제하는 정책으로 선회했죠.            그런데 아무리 봐도 그걸 실행하는 나라가 있네요.      섬나라.   																			"
"8","美 WSJ, “한국은 극심한 병상 부족 사태를 어떻게 해결했는가”","http://www.clien.net/service/board/park/14746745?od=T31&po=0&category=&groupCd=community","																										               미국의 유력지 월스트릿저널(Wall Street Journal)은 22일 “한국은 극심한 병상 부족 사태를 어떻게 해결했는가(How South Korea Solved Its Acute Hospital-Bed Shortage)” 제하의 기사에서 “저위험 확진자를 일반 연수시설로 전환함으로써 의료 시설과 인력을 확보하고 보호할 수 있었다”고 보도했다.출처 : 더브리핑(http://www.thebriefing.co.kr)      ------------   (사진이예요.누르지 마세요)   																			"
"9","보수언론 열심히 정신승리중이군요","http://www.clien.net/service/board/park/14746744?od=T31&po=0&category=&groupCd=community","																										      http://m.monthly.chosun.com/client/news/viw.asp?ctcd=A&amp;nNewsNumb=202004100022      링크는 월간 조선이니 안보셔도 됩니다.   영남에서 빼앗겼던 의석수를 가져와 미통당이&nbsp;   제1당이 될거라는 주장인데   저는 도저히 공감하기 힘들군요.   																			"
"10","분명 2주 재택근무를 위해 음식을 재워두는...","http://www.clien.net/service/board/park/14746743?od=T31&po=0&category=&groupCd=community","																										      사재기를 해 놨는데...      이거.. 사 놓고 재워 놔야하는데      낼름낼름 먹어지네요..       사재기가 아니라 그냥 사기를 했어요...   																			"
"11","65세 1000명당 병상수.korea","http://www.clien.net/service/board/park/14746742?od=T31&po=0&category=&groupCd=community","																										         인구 1000명당 병상 수로 보는게 아니라   실질적으로 문제가 되는 고위험군(65세 이상) 1000명당 병상의 수      입니다.      아래는 참고삼아 보세요   https://books.google.co.kr/books?id=i2SQDwAAQBAJ&amp;pg=PA206&amp;lpg=PA206&amp;dq=65%EC%84%B8+1000%EB%AA%85%EB%8B%B9+%EB%B3%91%EC%83%81+%EC%88%98&amp;source=bl&amp;ots=ZOL3pO4U9E&amp;sig=ACfU3U1ubelKfHdnrQcKqIGM4nAU9k-E7Q&amp;hl=ko&amp;sa=X&amp;ved=2ahUKEwiS2omz5a_oAhUCM94KHZqqDSgQ6AEwBXoECAkQAQ#v=onepage&amp;q=65%EC%84%B8%201000%EB%AA%85%EB%8B%B9%20%EB%B3%91%EC%83%81%20%EC%88%98&amp;f=false   																			"
"12","불매운동의 목적을 상기할 때입니다.","http://www.clien.net/service/board/park/14746741?od=T31&po=0&category=&groupCd=community","																										      불매운동은 그 가치에&nbsp;동의하는 사람이 늘수록 힘을 얻습니다      그런데 선택적으로 불매하고 있는 사람이&nbsp;   그 선택점 때문에&nbsp;비난받고 매도돼서 불매 자체를 중단한다면   누구에게 이득일까요?      불매운동은   남보다 더 불매하니까 더 나은 사람이고,&nbsp;   못하니까 더 못난 사람이라고&nbsp;   평가하기 위한 도구가 아닙니다      순혈주의는 불매운동에 도움되지 않는다고 생각합니다.&nbsp;   																			"
"13","이력서에 한줄밖에 없는 PD.jpg","http://www.clien.net/service/board/park/14746740?od=T31&po=0&category=&groupCd=community","																										      &nbsp; &nbsp;      																			"
"14","[LIVE] 황희석-장용진, <U+2714>권련기관 개혁, 어디까지 왔나? 라이브 중","http://www.clien.net/service/board/park/14746739?od=T31&po=0&category=&groupCd=community","																										        &nbsp;           &nbsp;황의석 예비후보님&nbsp; 지금 라이브 중이십니다.   																			"
"15","나경원 “유권자들 마음에 ‘민주당만 빼고’라는 울림 있어”","http://www.clien.net/service/board/park/14746738?od=T31&po=0&category=&groupCd=community","																										      [김능구의 정국진단] 나경원 “서울 민심은 양극화…절대 지지자와 절대 반대자로 나뉘어”   “유권자들 마음에 ‘민주당만 빼고’라는 울림 있어”“코로나19 극복을 위해서는 정부에 힘 실어줘야”“민주당 위성정당, 패스트트랙의 ‘셀프 심판’”“민주당 공관위원이 날 고발…정치공작의 음모”      보수통합에 대해서는 ”생각보다 시너지가 많이 나는 편은 아니다. 미래한국당이라던가 이런 부분이 명확치 않다“면서도 ”지금은 정체 상태이지만 다시 도약할 수 있다. 이유는 유권자들의 마음에 ‘민주당만 빼고’라는 울림이 있기 때문이다. 핵심은 ‘민주당만 빼고’다“라는 의견을 내놓았다.&nbsp;         &nbsp;나는 내 친구들 마음의 울림도 못 듣겠는데      &nbsp;이분은 용케 많은 사람들의 마음의 울림을 들으신다고 하네요 ㄷㄷㄷㄷㄷㄷㄷㄷㄷㄷㄷㄷㄷㄷ      																			"
"16","주문한것보다 더 비싼 택배가 왔네요","http://www.clien.net/service/board/park/14746737?od=T31&po=0&category=&groupCd=community","																										                     검색해보니까 교보문고 시그니처향수랍니다.. 6만 5천원 하는건데 세상에 어이가 없어서 웃음만 나오네요..ㅎㅎ   택배 깔 때 물 흔들리는 소리가 나서 설마~ 했는데 현실이였습니다..   역시 교보는 포장이 다르네~가 아니라 물품이 다르네...   상담원하고 통화해봤는데 교환받을 물품은 25일에서야 출발한다네요   이게 뭔 변인지..   																			"
"17","조중동과 일베충의 논리","http://www.clien.net/service/board/park/14746736?od=T31&po=0&category=&groupCd=community","																										      이슈 &nbsp;= 기레기와 일베충의태도   1. 국내 코로나확진자 발생 = 문재인책임   1-1. 다른나라도 확진자 발생 = 문재인책임   1-3. 확진자수 한국 순위 내려감 =그래도 문재인방역헛점   2. 신천지가 퍼뜨림 = 문재인책임   3. 사망자발생 = 문재인책임   4. 기생충 팀 격려 = 문재인 생각있냐?   5. 중국이 마스크 한국에 전달 = 문재인책임   6. 일본이 유람선 격리 = 문재인은 왜 안하냐?   7. 싱가폴 등 확진자 발생 = 한국보다 확진자 적으니 한국은&nbsp;문재인책임   8. 진단키드 보급 =fda안받았으니 문재인책임   9. 경제성장률 전세계적 폭락예상 = 문재인책임      너무도 빤하죠. 쟤들은 문재인탄핵을 통해 똥누리를 집권시켜서 한국을 일본의 속국으로 만드려고 하는게 확실해 보이네요. 못 알아채는 국민이 병신인 상황입니다.&nbsp;   																			"
"18","[공식] 콘텐츠 판다 측 ''사냥의 시간' 넷플릭스行, 일방적 계약해지..국제적 소송 준","http://www.clien.net/service/board/park/14746735?od=T31&po=0&category=&groupCd=community","																										      하지만 이 과정에서 '사냥의 시간' 해외 세일즈를 담당한 해외 배급 대행사 콘텐츠 판다와 합의를 도출하지 못해 잡음을 낸 것. '사냥의 시간'은 올해 열린 베를린영화제를 통해 공식적으로 20여개국에 선판매됐고 베를린영화제를 통해 얻은 호평으로 이후 10개국에 추가 판매 계약 및 논의 중이었던 상황에 리틀빅픽처스가 돌연 넷플릭스와 단독 계약을 추진하게 됐다. '사냥의 시간'은 넷플릭스를 통해 전 세계 단독 공개되고 극장 개봉이 사실상 불가능하게 된 '사냥의 시간'에 대해 배급 판권을 구입한 해외 배급사들은 '사냥의 시간'을 대리 판매한 콘텐츠 판다를 상대로 대규모 반발에 나선 상황이다.이와 관련해 콘텐츠 판다 측은 23일 오후 스포츠조선을 통해 ""리틀빅픽처스가 해외 세일즈사 콘텐츠 판다에게 일방적인 계약해지 통보를 했다""고 밝혔다.이어 ""콘텐츠 판다는 '사냥의 시간'이 베를린영화제에 초청받을 수 있도록 적극 홍보 및 마케팅에 나섰고 이뿐만 아니라 해외 30여개국 세일즈를 완료한 상황에 갑작스러운 넷플릭스 단독 개봉 소식에 매우 당황스럽다. 이미 해외 영화사들과 계약이 체결된 상황이었고 계약금도 일부 받은 상황이었다. 이달 중순쯤 리틀빅픽처스로부터 극장 개봉이 불가피해 계약을 해지하고 싶다는 요청이 왔는데 그때만 해도 넷플릭스와 단독 개봉 이야기는 전혀 없었다. 우리도 오늘(23일) 보도로 넷플릭스와 계약을 알게 됐다""고 불쾌한 심경을 전했다.또한 ""리틀빅픽처스에서는 우리가 합의를 받아들이지 않았다고 하는데 이는 사실이 아니다. 우리는 넷플릭스와 계약에 대해 전혀 몰랐고 이에 대한 논의 역시 없었다. 현재 '사냥의 시간' 배급권을 구매한 해외 배급사에서 반발이 상당하다. 넷플릭스 개봉 자체가 전 세계 동시 개봉인데 어떤 극장에서 그런 개봉 방식을 받아들일 수 있겠나? 특히 해외에서는 극장과 OTT 플랫폼에 대한 대립이 첨예하다. 해외 배급사들도 리틀빅픽처스의 계약 해지 통보에 대해 합의한 곳은 단 한 곳도 없다. 현재 국제적인 소송으로 이어질 수도 있는 만큼 법적 대응방안을 준비 중이다""고 밝혔다.&nbsp;         https://n.news.naver.com/entertain/article/076/0003545458         넷플한테 받은돈 소송비용으로 쓰이겠네요   																			"
"19","N번방 대화 중 뼈맞은 오덕.jpg","http://www.clien.net/service/board/park/14746734?od=T31&po=0&category=&groupCd=community","																										         그러므로 3D 여자를 멀리하고 2D 여자만을 가까이 하면 안전합니다.&nbsp;   																			"
"20","개인 사업자 차량 구매 혹은 리스 관련해서 문의 드립니다.","http://www.clien.net/service/board/kin/14746733?od=T31&po=0&category=&groupCd=community","																		 								      얼마전에 18만키로 가까이 되는 경차를 폐차했고 차량이 필요한 시점입니다.&nbsp;      개인사업을 시작했습니다. 그래서 궁금한것이 시업자 분들은 장기렌트나 리스로 이용해서 세금 처리 하시는것 같은데, 구매를 해도 세금처리가 안되는건가요? 세법 지식이 없어서요.&nbsp;      그리고 전기차르를 선호하는데 구매시 보조금 헤택이 있는데, 마찬가지로 장기렌트나 리스에서고 혜택을 받을 수 있는건지요?      어떤게 유리한지 몰라서 문의드립니다.&nbsp;      답변 미리 감사드립니다.         																			"
"21","궁금해서 물어본 갤럭시 폴드 기본케이스 재질","http://www.clien.net/service/board/park/14746732?od=T31&po=0&category=&groupCd=community","																										      폴드를 쓰시는 분들이라면 다 알고 계시는 기본 케이스!!            현재 제가 쓰고있는 케이스인데 이렇게 생겼죠~   3번정도 떨어트렸는데 꽤 튼튼한 재질로 되어있어서 궁금해서 물어봤습니다~            우레탄을 씌운 아라미드 섬유로 만든 케이스 라고 합니다~   결론은 우리가 흔히 얘기하는 탄소섬유가 맞네요~      500도 불에 태워도 안타고 일정두께가 되면 방탄도 된다는데   심장 부위에 항상 넣어두고 다녀야겠군요...ㅋㅋ   																			"
"22","2019~2012 천지인상 수상자들","http://www.clien.net/service/board/park/14746730?od=T31&po=0&category=&groupCd=community","																										         축하합니다.   저는 축하할려고 글 올린겁니다. 다들 축하해주세요.      참고 :비난 댓글 하지 말아주세요.(클리앙에 신천지 신도들 있어요)   																			"
"23","버즈+ 이쁘네요~ 사용해 본 총평은..","http://www.clien.net/service/board/park/14746729?od=T31&po=0&category=&groupCd=community","																										            색상은 약간 부담 스러운 유광 하늘색&nbsp;      거기다가 유닛도 하늘색 ㄷ ㄷ      확실히 음악감상은 버즈+가 이퀄라이저 설정도 가능해서 그런지      에어팟보다는 좋아요      (에어팟은 플랫 하다면 버즈는 사용자 조절이 가능하니 ㅎㅎ)      착용감은 에어팟보단 답답한 건 사실이고 또 한가지 좋은 건      터치패드가 활용도가 다양하다 보니 편하네요(볼륨 조절도 가능하니)      통품은 에어팟 보단 못하며, 주변 소리 듣기는 꽤 자연스럽게 하려고 노력을 많이 했네요      차음성은 에어팟프로의 노캔보다는 못하지만 그래도 좋습니다 ㅎㅎ   																			"
"24","사재기는 클량 아재들이 전문인데요","http://www.clien.net/service/board/park/14746728?od=T31&po=0&category=&groupCd=community","																										         안하는 게임 사재기 한게 수십개는 되싷 것 같은데요   																			"
"25","메스컴 차별 너무 심하네요","http://www.clien.net/service/board/park/14746726?od=T31&po=0&category=&groupCd=community","																										      나도 석사고   진석사도 석산데      나도 오징어고   진석사도 오징어인데      진석사도 전공분야 아니고   나도 내 전공분야도 아닌데      진석사는 테레비에 나오고   나는 테레비에 안나오고 이건 차별임뮈돵~      나도 진석사만큼 헛소리 할 자신있숨미당~   안되면 자폭개그라도 하겠숨미돵~   																			"
"26","통합당의 무리수.. '조국은 n번방 가해자들의 영웅'","http://www.clien.net/service/board/park/14746724?od=T31&po=0&category=&groupCd=community","																										               &nbsp;학살자들을 영웅 취급하는 분들이 누구더라..............? (질문이다!)      &nbsp;정말 너무하네요 ㅠㅠ   																			"
"27","아직 고인물 저보다 오래된 분은 없네요?","http://www.clien.net/service/board/park/14746723?od=T31&po=0&category=&groupCd=community","																										      예전에는 kpug가 메인이고 클량은 파생 같은 개념이었죠.   그때부터 가입한 클리앙 극초반 멤버 입니다만... 어렴풋이 기억에 한번 리뉴얼 되면서 가입일시가 일괄로 초기화 되었습니다.   그래서 아마 그떄 유저들은 다 저랑 동일 할듯하네요.&nbsp;   그런데 글들 보니깐, 그떄분들 많이 나가셨나..별로 안보이네요.   뭐 저는 거의 읽기만 해서 가입일자에 비해 글수나 댓글은 턱없이 부족합니다만..      암튼 저 이하로 오래된분은 없을거라 생각하네요.               																			"
"28","장염5일차 몸이 망가지네요","http://www.clien.net/service/board/park/14746722?od=T31&po=0&category=&groupCd=community","																										      (만약에 이거 대신이라면)외상이면 그래도 먹는건 덜할텐데요.      그래도 근 2년 가까이 만들었던 몸이 이번 장염하나에 무너지네요.   등치나 골격이 좋은 체질이 아니라 loss는 순신간입니다.   글찮아도 그나마 했던 운동도 코로나로 근 한달이상 못하고 있고요.      피골 상접까지는 아니지만 살이 쪽 빠지고   약을 먹으려니 미음/죽 안먹을 수도 없고 ㅅㅅ는 계속 하고...ㅠㅠ   수액은 1일차에 맞았어야 했는데 그때는 나갈 기운도 없던때라 타이밍을 놓친듯 하구요.      머릿속에서는 계속 맛있는 것들이 떠오르니 위는 더욱 더 쓰려오고...   몸 따로 마음 따로입니다.      &nbsp;   																			"
"29","쿠팡 KN95 직구 평이 안 좋군요","http://www.clien.net/service/board/park/14746720?od=T31&po=0&category=&groupCd=community","																										      귀 아파요   작아요   냄새 나요   오리처럼 튀어나오는 모양이 별로에요      등등 평이 안 좋군요.   다들 달려 있는 평이 대한민국 마스크가 짱이에요.   왜 그렇게 한국산을 선호했는지 알 것 같네요.   																			"
"30","근데 n번방 관련해서 avsnoop이 자주 언급되는데","http://www.clien.net/service/board/park/14746719?od=T31&po=0&category=&groupCd=community","																										      기억이 가물가물하긴 한데   예전에 ㅇㄷ 받으러 avsnoop은 저도 들어갔던 기억이 어렴풋이 있어서 불안하네요 ㅡㅅㅡ   물론 전 품번있는 정품(?)ㅇㄷ만 취급했으니 괜찮겠죠..   																			"
"31","뜬금없는 얘기지만 31번 확진자...","http://www.clien.net/service/board/park/14746718?od=T31&po=1&category=&groupCd=community","																										      퇴원했겠죠?&nbsp;   그때 확진자 터지기 시작하면서 카오스에 빠진지가&nbsp;   한 몇개월 지난기분이네요.&nbsp;   																			"
"32","울산 터미네이터 풀 영상.tube","http://www.clien.net/service/board/park/14746717?od=T31&po=1&category=&groupCd=community","																										             한국에로 영화처럼 중요부위는 교묘하게 다 피하네요   																			"
"33","위 건강 지식인 계세요?","http://www.clien.net/service/board/kin/14746714?od=T31&po=1&category=&groupCd=community","																		 								      평소 소화가 어려운 사람을 위한 위 건강 생활식습관, 운동법, 영양제 추천 조언 구합니다.   감사합니다.   																			"
"34","갑자기 외기온도 21도... 봄이네요","http://www.clien.net/service/board/park/14746713?od=T31&po=1&category=&groupCd=community","																																																															      덥네요....   																			"
"35","앱을 개발해 구글 플레이 스트어에 올릴려는데요 서버,웹호스팅이 필요할까요?","http://www.clien.net/service/board/kin/14746712?od=T31&po=1&category=&groupCd=community","																		 								         회사에서 동영상을 올리면 고객이 구글 플레이 스토어에서 해당 앱을 다운받아 시청하는 시스템을 구축할려합니다.      그렬려면 일반 홈페이지처럼&nbsp; 앱도 호스팅이란 개념이 필요한가해서요?      이쪽 분야를 전혀 몰라서요~      아시는분 도와주세요 ~~      ^^   																			"
