"","title","url_val","contentlist"
"69","헬스장 휴업 강력 권고는 지키는게 자신들에게도 좋을텐데 말이죠","http://www.clien.net/service/board/park/14746667?od=T31&po=2&category=&groupCd=community","																										      당장 2~3주 매출 줄어드는게 힘든건 100% 이해합니다만, 이걸로 정부 욕하는건 매우 어리석어보입니다.   왜냐면, 와이프가 학원강사인데, 학원업계가 초반에 코로나 가볍게 보다 아주 큰 타격을 받고 있는 중이거든요.&nbsp;   아마 부산에서 학원강사로부터 학생에게 감염된 사례 기억하시는 분 많을거에요.   코로나 사태 터지고 초반 (2월 말경) 학원들이 1주일 정도 쉬었다가 다시 열라 하다가.. 저 사건 이후로 학부모들의 대규모 휴원 요구 &nbsp;혹은 항의로 인해 한 달간 휴강하거나 사이버강의 대체하는 학원들이 많아졌어요. 저희 와이프가 일하는 학원도 같은 상황으로 3월 말까진 학부모 의견에 따라 사이버강의 혹은 휴원을 받아주고 있는 상황입니다.   아직 국내에 헬스장 감염 사례가 있는지 모르겠는데, 조금씩 지역감염 사례가 나오고 있는 현 상황에서 만일 단 한 군데에서 헬스장 내 감염 사례가 나오면 전국 최소 절반 이상의 헬스장들은 몇 달간 곡소리 날겁니다. 실제로 헬스장의 경우 맨손으로 운동기구를 서로 만지면서 운동하다 쉽게 감염이 될 수 있는 상황이라 일본에서 &nbsp;헬스장 내 집단 감염 추정 사례가 있기도 했구요.   그럼 2주 어렵게 버티면 좋아질수도 있는 상황이 그냥 부도나는거는거죠.   차라리 정부에게 일정 부분 보상을 요구하는게 나을겁니다.   																			"
"70","우리나라 만큼 종교의 자유가 보장되는 나라가 있나요?","http://www.clien.net/service/board/park/14746665?od=T31&po=2&category=&groupCd=community","																										      신천지를 종교로 인정도 해주고   개신교 임대료 지원까지 해준다는군요.   누가 ?? &nbsp;대구시장이...      성실하게 세금 잘내는 자영업자들은????   																			"
"71","제가 즐겨 보는 유튜버","http://www.clien.net/service/board/park/14746663?od=T31&po=2&category=&groupCd=community","																										      IT유튜버인데 기성 유튜버가 마음에 안 들어 만든 걸로 압니다.   중국에 거주해서 다양한 중국 핸드폰 비교는 한국에서 이만한 채널이 없고, 카메라 분석도 상당히 일가견이 있어 자주 봅니다.      GW1 센서 채택한 샤오미 폰으로 갈까하다 픽셀 3a 추천하시는 걸 보고 바로 선회했습니다.                                           																			"
"72","공대 대학원 나와서 반도체쪽 오니까 조사빼고 다 영어네요","http://www.clien.net/service/board/park/14746662?od=T31&po=2&category=&groupCd=community","																										      특히 외국계 업체랑 일하다보니    휴가라는 단어도 PTO로 쓰고 있네요   																			"
"73","심재철 '마스크 줄세우기 도대체 언제까지 할꺼냐'","http://www.clien.net/service/board/park/14746661?od=T31&po=2&category=&groupCd=community","																										      그는 ""마스크 대란이 계속되는데, 제조업체들 불만과 유통마진 의혹이 쌓여간다""며 ""제조업체들은 장당 900원에 납품한다. 유통업체는 1천600원에 팔아 장당 500원의 이익을 남긴다. 생산 부담은 제조업체들이 지고, 혜택은 유통업체들이 누린다""고 주장했다.         																			"
"74","하... 답답하네요...","http://www.clien.net/service/board/park/14746660?od=T31&po=2&category=&groupCd=community","																										      수년 전.. ""살인진드기""로 한창 시끄럽던 해가 있었습니다..   기억에 살인진드기에 물리고 1~2주간의 잠복기 후 증세가 발현된 후 심각한 경우에 사망까지도 이를 수 있다고...   그 해의 추석을 맞이해 친척들이 모두 모이고 성묘를 갈 시점이 되었습니다..   도통 그러시지 않으시던 거동이 불편하신 할아버지께서 동행을 하시겠다 하시더군요...   첫번째로 살인진드기가 걱정이 되고, 거동도 불편하신 와중에 산 중턱에 위치한 산소까지 올라가실 수 없다고   극구 만류했습니다. 저 혼자.. 다른 친척들은 과한 걱정이라며 모시자고 하더군요... 뭐 그리 젊은 놈이 겁이 많냐며...   그때 살인진드기란 놈도 고령인 분들에게 더 치명적이라고 했던 것 같습니다..   결국, 저 혼자만 반대하고 모두들 괜찮다는 의견에 모셨습니다... 결국 가시고 오시며 부축도 제가 다 하고   다른 분들은 그저 바라보기만 했던 기억이 있네요... 뭐 제가 조금 불편했던 건 상관 없었습니다.   하지만 그 이후에 몇주간 걱정으로 맘 조렸던 기억이 나네요..   뭐 결국 걱정했던 일은 없었지만요... 아무런 대책도 없는 괜찮다는 불감증은 너무 싫습니다.. 지금도요..      지금의 코로나도 마찬가지인 것 같아요...   지난 주말 전국 각지의 관광명소들이 방문객들로 북새통이었다고 하더군요..   지금 코로나가 해결된 것도 아니고 한참동안은 조심해야 할 상황인 것 같은데...   이렇게 방심했다 감염되면 그 땐 누굴 원망할런지.. 재수없었다로 끝 날 문제도 아닌데.. 하...   조금만 더 과하다 싶을 정도로 조심하는게 좋지않을까 싶은데 말이죠...   그저 답답한 마음에 두서 없이...&nbsp;   																			"
"75","이슈가 되고 있는 요가원 문자랑은 달라서 다행입니다.","http://www.clien.net/service/board/park/14746658?od=T31&po=2&category=&groupCd=community","																										            정부에서 발표한 4/3까지 시설들 폐쇄권고때문인지 저희 요가원도 똑같이 휴원한다고 문자왔네요&nbsp;         																			"
"76","아이폰은 이제 마스크 써도 열리는데","http://www.clien.net/service/board/park/14746657?od=T31&po=2&category=&groupCd=community","																										      아이패드는 아직도 학습이 안됐나 안열려유 ㄱ-   																			"
"77","이승환 형님은 세월이 비켜가네요..","http://www.clien.net/service/board/park/14746656?od=T31&po=2&category=&groupCd=community","																										                근데 승환 형님을 비켜간 세월이 왜 저만 정통으로 때리는 걸까요..      아..정말 노래도 좋고 가사도 좋고 영상도 좋고..최고네요 ㅠ.ㅠ   																			"
"78","서울사랑상품권 20% 할인이네요. (제로페이)","http://www.clien.net/service/board/park/14746654?od=T31&po=2&category=&groupCd=community","																																																																																																				         사용처가 적은게 흠이지만...   대형마트가 안되는군여ㄷㄷ         http://news.seoul.go.kr/economy/archives/506584   																			"
"79","성폭행 묻지마 재판을 보니 민식이법도 걱정 되네요.","http://www.clien.net/service/board/park/14746652?od=T31&po=2&category=&groupCd=community","																										      판사가 공정한 재판을 못하고 언론과 여론의 눈치를 보는데   낼 모레부터 민식이법 시행되면 억울할 운전자들 많이 생길듯 하네요.   아무리 조심하더라도 나에게 억울한 사고는 생길 수 있으니까요;;   																			"
"80","지난주에 아이폰 XSM 무리하게 구입했는데, 이번주 XS 가 싸게 풀리네요...","http://www.clien.net/service/board/park/14746650?od=T31&po=2&category=&groupCd=community","																										      지지난 주말에 아이폰 XS Max 가 나왔는데 주말 당시에는 몰라서 못사고,   결국 월요일에 그나마 남은거 줍줍해서 마눌님 바꿔줬는데요.      처음 나왔을 때는 괜찮은 가격 많았는데 그런 조건은 다 이미 매진되고,   제가 구입한 시점에는 쩌리 조건만 남아서 6개월 유지 19만원에 64기가 정도로 구했습니다.      그런데 오늘 보니 같은 조건/가격에 XS 512 기가를 살 수 있네요.ㅡㅜ   게다가 지난주 처럼 구하기 어려운 것도 아닌것 같고...      마눌님께서는 일단 6.5인치가 5.8인치보다 낫다고 위로를 해 주시고,   용량 쓸 일이 별로 없어서 64기가도 충분하다는데, 다만&nbsp;오늘부터 아이클라우드 200G를 신청 하셨군요...ㅡㅡ;   																			"
"81","'총선 지지' 민주당 38.5%·미래통합당 23.1%","http://www.clien.net/service/board/park/14746649?od=T31&po=2&category=&groupCd=community","																																																																																																				      비례대표 정당 투표 시 지지 정당 조사에서는 통합당의 위성정당(자매정당)인 미래한국당이 1위를 차지했으나, 범여권 정당 총합에는 미치지 못했다. 이 같은 결과는 문화일보가 여론조사 전문기관 엠브레인퍼블릭에 의뢰해 지난 20∼21일 전국 만 18세 이상 남녀 1011명을 상대로 한 여론조사(95% 신뢰 수준에 표본오차 ±3.1%포인트)에서 나왔다.      부산·울산·경남(PK)에서 민주당 35.8%, 통합당 31.9%로 박빙이었다.&nbsp;   비례대표 투표 정당은 한국당 20.4%, 범여권 비례대표 연합정당인 더불어시민당 16.5%, 정의당 9.1%, 손혜원 의원과 정봉주 전 의원이 주도하는 열린민주당 6.9%, 국민의당 5.3% 순이었다. 시민당과 열린민주당 지지율을 합하면 23.4%로, 한국당 지지율을 앞섰다      이하   .......   																			"
"82","부산서 꽃 놀이 다녀온 60대 남녀 코로나19 확진...경주 35번과 접촉","http://www.clien.net/service/board/park/14746648?od=T31&po=2&category=&groupCd=community","																										      [서울경제] 부산서 꽃 축제 나들이를 다녀온 60대 남녀가 신종 코로나바이러스 감염증(코로나19) 확진 판정을 받았다.23일 부산시 보건당국은 전날 196건을 검사해 2명이 양성 판정을 받았다고 밝혔다.   이번 확진 판정을 받은 환자는 사하구에 사는 62세 여성(106번 확진자)과 62세 남성(107번 확진자)이다.부산시 역학 조사 결과 두 사람은 지난 18일 전남 구례군 산수유 마을에 함께 다녀온 것으로 확인됐다. 이들은 같은 날 산수유 마을을 다녀간 경주지역 35번 확진자(60세·여성)와 접촉해 감염된 것으로 시 보건당국은 추정했다.구례군에서 나서 축제를 취소했지만, 이들은 많은 사람이 모이는 나들이 장소에 갔다가 감염된 것으로 보인다. 106번 확진자 남편은 음성 판정을 받았고, 107번 확진자는 혼자 거주하는 것으로 알려졌다.      두 사람은 경주 35번 확진자가 양성 판정을 받았다는 통보를 받고 지난 21일부터 자가격리 중이었다.부산에서 확진자가 2명 나옴에 따라 지난 18일 산수유 마을을 다녀간 사람 중에서 추가로 감염자가 나올 수도 있는 상황이다.      ========================   꽃이 앞으로 계속 필텐데&nbsp;   																			"
"83","마약짤 방출","http://www.clien.net/service/board/park/14746646?od=T31&po=2&category=&groupCd=community","																																																															      몇일전 많은 클리앙 회원님들께 출산 축하를 받았습니다.&nbsp;   감사합니다!!&nbsp;   제가 너무나도 학수고대하던 짤을 드디어 만들었습니다.   너무 귀엽고 소중하고 그렇네요. 하하하하      																			"
"84","기사 제목들이 가관이 아니군요.","http://www.clien.net/service/board/park/14746645?od=T31&po=2&category=&groupCd=community","																										      어떤 기사는 독일 총리를 확진자로 보이게 만들지 않나...   또 어떤 기사는 유럽 유학생 한 명을 전혀 상관없는 다른 일가족(해외여행력 없음)과 연결되어 보이게 적어서 학생을 더욱 욕 먹게 만들지 않나...      오늘 클리앙에 올라온 것만 봐도 이렇네요.   물론 어디까지나 ""헷갈리도록"" 적었을 뿐 문제 삼으면 빠져나갈 수 있게 적어놨습니다. 너무하네 정말...   																			"
"85","이과출신들은 이해하십니다.","http://www.clien.net/service/board/park/14746644?od=T31&po=2&category=&groupCd=community","																										                   GIF      그렇다고 믿습니다!      저는 공대출신인지라.   																			"
"86","강서갑 강선우 트윗(feat.한정애 의원님)","http://www.clien.net/service/board/park/14746642?od=T31&po=2&category=&groupCd=community","																										                                 늘 말하지만 제가 할 수 있는건 홍보뿐   다 국회로~   																			"
"87","텔레그램 사용법.jpg","http://www.clien.net/service/board/park/14746641?od=T31&po=2&category=&groupCd=community","																																																															      pixiv 긁어오기 정말인가요 오타쿠님들?   																			"
"88","다래끼 짜는거 엄청 아프네요","http://www.clien.net/service/board/park/14746640?od=T31&po=2&category=&groupCd=community","																										      약먹을래 절개할래 물어볼깨 처음에는 약 먹는다고 했다가 왠지 쫄보인것 같아서 절개를 선택했습니다.      1. 안약을 넣습니다.   2. 뭔가로 콱 잡습니다. 아픕니다??   3. 뭔가로 아프게 합니다?? 아악 이런 느낌?   4. 사정없이 아픕니다. 나이 들어서 소리는 못 내겠고 양주먹 쥐고 한 일분 참았네요.   5. 괜히 했나 후회하는데 끝납니다.      거즈를 서너번 갈고 빛 쬐주고 온찜질 했네요.   피가 아주 철철이네요.. 무섭다..      그리고 약과 안약 받았네요. 안과 선생님이 옆에 하나 더 있다고 그건 다음에 또 나면 보자고 하십니다.   선생님.. 왠지 우리 와이프처럼 짜는거 좋아하시는것 같네요..?      지금은 피눈물 상태라서 오른쪽 눈이 뿌옇게 보이는데 비비지도 못하고 있네요.   																			"
"89","1종 대형면허 취득절차 질문합니다.","http://www.clien.net/service/board/kin/14746639?od=T31&po=2&category=&groupCd=community","																		 								      현재 2종보통 면허를 가지고 있습니다.      1. 운전경력(면허보유) 1년이상이라건데 1종보통만 해당인가요? 아님 2종도 상관없나요?   2.필기시험의 경우 재응시해야하나요? 시험은 1종보통/2종보통 필기시험과 동일한 문제인가요?   3. 도로주행 없이 장내만 보면 된다던데 맞나요?   																			"
"90","동물의 숲(Animal Crossing) 대신 얼터너티브x크로스오버(Alternative x CrossOver)","http://www.clien.net/service/board/park/14746638?od=T31&po=2&category=&groupCd=community","																										      우선 제목으로 낚시를 드려서 죄송한 사과를 드립니다.91년 시애틀 밴드 / 너바나, 펄점, 사운드가든, 앨리스인체인스, STP 등/ 가 대박을 치면서 얼터너티브락이라는 용어가 정리되었습니다.그런데 위 밴드를 보면 각각 사운드의 뿌리가 다 다릅니다. 펑크, 아메리칸 루트락, 헤비메탈 등...얼터너티브락이 이전의 모던락을 모두 수용한 형태로 정리되다보니, 다른 장르와 크로스오버가 많이 나오기도 하는데요. (돌아가신 투팍 아재도 락앤롤 명예의 전당에 헌액되었잖아요)최근 얼터너티브 라디오 방송국에서 많이 들리는 크로스오버 곡들을 몇가지 소개하겠습니다.    Ashe - Moral Of The Story    Ashe는 일렉트로팝 / 인디포크락을 주 장르로 하는 젊은 여자 가수인데요.    Moral Of The Story는 2019년 1월에 나온 곡이지만, 빌보드 Hot 100(싱글차트)에는 상당히 시간이 지난 후 진입했습니다.    넷플릭스의 To All the Boys: P.S. I Still Love You 에 주제가로 쓰이면서 상승세를 얻었습니다.    2018년 이혼 후 자료를 정리하면서(93년 생인데...) 이 곡을 쓰기 시작했습니다. 이 노래는 일종의 치유곡으로 작곡했다네요.    이번 주 빌보드 얼터너티브송 차트에는 39위로 올라왔습니다.(첫 진입)          Post Malone - Circle    워낙 유명한 래퍼이기 때문에 소개는 생략하겠습니다.    Post Malone은 락음악가들과 협업을 몇번했는데요, 최근에 오지 오스본 할배와 Take What You Want 곡으로 빌보드 Hot 100 8위를 기록했었죠.    Circle은 적당히 랩과 얼터너티브락에서 절충점을 찾은 듣기 좋은 노래로, 이미 2019년에 빌보드 Hot 100 1위 기록했었습니다.    최근 빌보드 얼터너티브송 차트에 올라왔고, 이번 주 27위를 기록하고 있습니다.          Machine Gun Kelly - why are you here    Machine Gun Kelly도 이미 유명한 래퍼인데요. 빌보드 Hot 100에 4위를 했던 Bad Things같은 경우, 텍사스 오스틴 출신 얼터너티브락밴드 Fastball의 Out of My Head를 샘플링하기도 했었습니다.(공동 작곡가로 올라감)    이전 곡인 I Think I'm Okay과 비슷하게, 상당히 얼터너티브락스러운 사운드를 들려줍니다.    해당 곡은 아직 차트에 올라가지는 않았는데, 최근 라디오에서 많이 들리는 것으로 보아서는 곧 차트에 진입할 것 같습니다.    그리고 제가 공연장에서 본적이 있는데, Machine Gun Kelly는 키가 엄청 크고 말랐습니다. 완전 위너입니다.(190cm 넘는데요)     																			"
"91","람보르기니 오픈카 드리프트.gif","http://www.clien.net/service/board/park/14746637?od=T31&po=3&category=&groupCd=community","																																																																																																				GIF																																	      차 잘나가네요   																			"
"92","출근할때 호드 티셔츠 입고 출근합니다","http://www.clien.net/service/board/park/14746636?od=T31&po=3&category=&groupCd=community","																										      정확히는 셔츠안에 호드 티셔츠입습니다      집에 호드 티셔츠가 3장있는데      하나는 걸레용      하나는 운동용      하나는 출근용입니다    가장 더럽고 힘들때만 입습니다   																			"
"93","식탁의자 등받이에서 못이 튀어 나왔는데 무상AS 해줄까요","http://www.clien.net/service/board/kin/14746635?od=T31&po=3&category=&groupCd=community","																		 								      국내 메이저 가구업체 &nbsp;식탁의자를&nbsp;   2년 3개월전쯤에 구입해서 쓰고있는데   작년 초부터 뒤로 기대면   뭔가 뾰족한 게 등을 찌르는 느낌이 들었는데      이게 몇일전에는 뒤로 기대면 &nbsp;못같은게 &nbsp;등받이 가죽을 뚫고 나와 등을 찌릅니다   무상 1년 AS는 끝난상태로   &nbsp;이걸 제품하자로 &nbsp;무상AS &nbsp;요청하면   진상소리 들을까요?      																			"
"94","미국 군용 드론.gif","http://www.clien.net/service/board/park/14746634?od=T31&po=3&category=&groupCd=community","																										                   GIF                GIF                   GIF                   GIF                   GIF                   GIF      ㄷㄷㄷ      																			"
"95","남아도는 라유를 처리하는 방법","http://www.clien.net/service/board/park/14746633?od=T31&po=3&category=&groupCd=community","																										         1. 마파두부. 마파두부는 한국인에게 익숙하면서도 은근히 두반장과 라유를 많이 써서 집에 남아도는 라유 처리에 좋습니다.      2. 야채, 마늘, 울금, 산초 등을 라유로로 볶습니다. 그러면 보관도 오래 되고 단독으로 먹어도, 어디에 넣어도 자연스러운 만능 반찬이 됩니다. 취향에 따라 고기, 굴소스, 양파, 고추 등도 넣을 수 있습니다.   																			"
"96","권영진 '신천지 교인도 긴급생계지원 대상 포함'","http://www.clien.net/service/board/park/14746632?od=T31&po=3&category=&groupCd=community","																										               (서울·대구=뉴스1) 정재민 기자,김도엽 기자,남승렬 기자 = 권영진 대구시장이 신종 코로나바이러스 감염증(코로나19) 관련 긴급생계지원 대상에 신천지예수교 증거장막성전(신천지) 교인도 포함된다고 밝혔다.      권 시장은 23일 오전 10시30분 대구시청에서 열린 코로나19 정례브리핑에서 ""신천지인지 아닌지와 관계가 있는 것이 아니고 입원 중이거나 자가격리 상태에서 2주를 유지한 경우 정부 기준으로 지급하게 돼 있다""고 말했다.      이어 ""신천지라고 해서 특별하게 지원하고 안하고 하는 기준은 없다""고 덧붙였다.            &nbsp;가짜뉴스이길 바랐으나............      &nbsp;가짜뉴스가 아니었네요..........   																			"
"97","'일부' 개신교회 예배 강행이유 이게 가장 크다 봅니다","http://www.clien.net/service/board/park/14746631?od=T31&po=3&category=&groupCd=community","																										      안녕하세요.   지금 정권이 워낙에 아니꼽고 ""나라망한다""""공산당정권"" 그러니 말을 안 듣는거죠   간단히 말해 문재인 싫어서죠.   그 '일부' 개신교회들이 예수 믿어서 집회, 예배한다고 보시면 상당히 오해입니다      이숭마니 꽁무니 좇는 자들의 당, 초이태미니 집, 초이순시리, ㄹ해 쪼다나 쫓아다니는 당이 집권했다면&nbsp;   냉큼 바로 예배,집회 무기한 정지했을 거에요.      이런 자들은 승마니 정신을 받드는 자들이지 예수쫓아다니는 자들이 아니에요   지금도 '일부'개신교회를 예수 추종자라 생각하시면 오산입니다...   예수는 명분에 불과하죠.   																			"
"98","내일이 김경수지사 항소심 첫 공판일 이네요","http://www.clien.net/service/board/park/14746629?od=T31&po=3&category=&groupCd=community","																										      재판부가 교체되긴 했지만 전재판부가 빅똥을 싸지르고 간 상황이라.....지켜봐야 겠네요.      시연회를 봤다고 확정짓고 나간&nbsp;상태라서......심히 걱정되네요   																			"
"99","제가 돈이 많다면 교회에 헌금 지원해주고 싶네요.","http://www.clien.net/service/board/park/14746627?od=T31&po=3&category=&groupCd=community","																										      2주치 헌금 내줄터이니 예배보지 마라.         하면........         70%는 예배 안 보겠죠?   																			"
"100","그 요가학원도 체인점 같던데..","http://www.clien.net/service/board/park/14746624?od=T31&po=3&category=&groupCd=community","																										      체인점이 저러면 본사는 뭐 어떻게 해야할 지 감도 안오네여 -ㅅ-) ㄸ      사과문 써도 잘 먹힐지 의문이고..-.-);;   																			"
"101","동숲 논란은 솔직히 어리둥절이죠","http://www.clien.net/service/board/park/14746623?od=T31&po=3&category=&groupCd=community","																										      니콘, 캐논, 소니 DSLR 반응   와 사진 정말 잘 찍으시네요   같은 모델 쓰시다니 반갑네요   기타 질문 사항      소니 이어폰 반응   구매할까 고민중인데 성능 어떤가요?   에어팟프로랑 비교해서 어떤가요?   에어팟프로보다 좋습니다   신모델 나왔다니 사야겠네요 등등      소니 모델하는 아이유 반응   존예!   아이유랑 같은 제품 써야죠 ㅎㅎ 등등      링피트 반응   아 어디서 구하죠 ㅠㅠ   저도 하고 있는데 운동 잘 되네요 ㅎㅎ 등등      포켓몬 반응   새로나온거 재밌네요   타노스 당했어도 DLC로라도 풀어서 다행이네요   게임보이로 오랜만에 하는데 좋네요 등등         동숲 반응   토왜네요   고작 게임에 나라 팔아먹나요   눈치 챙겨야지 왜 글을 쓰나요      노노재팬 이후로 취미 영역의 소비에는 문제없다는 반응이었는데      이상하리만치 동숲에만 엄격한게 이상하다 싶습니다.      대중성 있는 일본제품은 괜찮고 매니아층용 일본제품은 안되는걸까요?   콘솔 유저들 토왜 만들어서 뭐가 이득인가요. 대부분 콘솔 유저들이 본인 취미영역인 게임은 어쩔 수 없이 사도 다른 일제들은 불매 잘하는 사람들일텐데요.      콘솔 유저들 전부 불매운동 포기시키려는걸까요? 솔직히 순수한 불매운동 지지로 안보입니다.   																			"
"102","야구 응원용품에서 발암물질 검출.jpg","http://www.clien.net/service/board/park/14746622?od=T31&po=3&category=&groupCd=community","																																																															            야구를 못해서 암걸리는게 아니었어요!   																			"
