"","title","url_val","contentlist"
"147","은근히 만능인 중국 소스","http://www.clien.net/service/board/park/14746557?od=T31&po=4&category=&groupCd=community","																										         일명 노간마(라오칸마) 소스.   일종의 고추기름입니다만 거기에 뼈육수나 야채, 견과류를 넣은 바리에이션 등이 있습니다.   밥에 비벼먹어도, 요리 만들때 써도 어지간하면 어울리더군요.   주로 제가 사용하는 방법은 반숙 계란후라이 얹은 밥에 저 소스를 뿌려 비벼먹거나   아니면 라면에 저걸 살짝 치는 겁니다.   단점은 마트에 거의 안 팔고 인터넷이나 중국식료품점 가야 겨우 보이는 정도?   																			"
"148","N번방 기록 100% 확실하게 지우기","http://www.clien.net/service/board/park/14746555?od=T31&po=4&category=&groupCd=community","																										      해준다고 광고 때려놓고 신청인들 모집해서 명단을 경찰에 넘겨주고 싶네요. 톱으로 썰어죽여도 아쉬운 %×#@ 들.   																			"
"149","서양야동을 싫어하는 이유.txt","http://www.clien.net/service/board/park/14746553?od=T31&po=4&category=&groupCd=community","																										      그...보이스랑 표정이 다들 너무 전투적이란 말이죠.   ex : 오 쉣!! 오마이갓!!! 홀리쉿!!!!! 오 쀀!!!!!!!   																			"
"150","클량 뉴비.인증","http://www.clien.net/service/board/park/14746551?od=T31&po=4&category=&groupCd=community","																										         제목 수정:   클량 고인물 뉴비.인증               어느덧 새소게 작성가능권에 들어왔네요. (소식이 느린 제가 새소식 올릴 일은 없겠지만 ^^)      2009년에 왜 가입했는지는 기억이 안나요.   2011년이었나 노트1 언팩하러 IFA가서 소비자 반응보느라고 그때부터 자주 왔던 것 같아요.   (첫글도 2011년이네요.)      냥당, 육아당에서 나름 재미있게 지내던 시절도 있었고 대부분 눈팅이나 자잘한 일상이었네요.&nbsp;   (게시물 1000개 넘는게... 1년에 100개씩이나 내가?싶지만... 근데 내가 쓴 글 이력보니 별별 얘길 ㅎㅎㅎ)      써놓은 글보니 10년 동안 내 삶에 있었던 일들을 기억할 수 있어서 좋네요.   10년어치 치고는 약소한 내역이지만, 앞으로도 가끔 뻘글 남기면 10년 후에 또 뭔가 추억거리가 되겠지요.      그럼 모두 건강하세요~   																			"
"151","시중 마트에서도 마스크 쫌 풀렸나 봅니다?","http://www.clien.net/service/board/park/14746550?od=T31&po=5&category=&groupCd=community","																										      와이프가 방금 카톡에서 집 앞 대기엄 슈퍼마켓에서 마스크 장당 2500원주고 5장 샀다네요?      가격이 쫌 사악하지만.. 그래도 물량이 쫌 풀렸나 봅니다?      시골 동네까지 온거 보면..    이제 스트레스 안받을까요? ㅠㅠ   																			"
"152","갑자기 생각나는 명텐도..","http://www.clien.net/service/board/park/14746549?od=T31&po=5&category=&groupCd=community","																										      https://gamemook.com/m/178   그래도 어스토니시아스토리R로 흥할뻔 했는데..   																			"
"153","얼라는 명예가 없다고...","http://www.clien.net/service/board/park/14746548?od=T31&po=5&category=&groupCd=community","																										      하지만 호드는 존재가 없죠.&nbsp;      호드 이즈 나띵!&nbsp;   																			"
"154","일관된 증언은 DNA보다 강력한 증거입니다","http://www.clien.net/service/board/park/14746547?od=T31&po=5&category=&groupCd=community","																										      1. A는 이씨가 자신은 강간했다며 신고. 질내사정을 하였다고 주장   2. 이씨는 이를 부인함   3. DNA검사결과 이씨의 유전자 미검출   4. 재판부는 사정시간이 짧으면 유전자가 미검출될 수 있고 다른 증언이 일관된다는 이유로 2년 6월 실형      이럴꺼 성범죄 재판은 왜합니까? 그냥 피해자가 주장하면 그대로 인정할꺼 판사는 형량만 정하면 되지요.      https://mobile.newsis.com/view.html?ar_id=NISX20200320_0000964281      지인인 A씨를 강간한 혐의로 지난해 10월 재판에 넘겨졌다. 이씨는 A씨와 함께 간 노래방에서 노래를 부르다 갑자기 A씨를 소파에 넘어뜨린 뒤 A씨의 바지를 내리는 등 성관계를 시도한 혐의를 받았다.그런데 A씨는 당시 이씨가 사정을 했다고 주장했지만, 실제 감정에서는 이씨의 정액 DNA가 검출되지 않은 것으로 전해졌다.   																			"
"155","ASUS AC68A 공유기 QoS 설정 방법 질문 드립니다.","http://www.clien.net/service/board/kin/14746546?od=T31&po=5&category=&groupCd=community","																		 								      현재 U+ UHD 셋탑과 + 기가 라이트(500Mb/s) 인터넷 상품을 사용하고 있습니다.&nbsp;      궁금한게 평소 UHD 셋탑으로 TV를 보고 있는 상태에서   컴퓨터로 FTP나 토렌트 다운로드시 대역폭이 확 커져버리면   거실에서 TV 보고 있던 UHD 셋탑이 뚝뚝 끊기면서 제대로 볼 수 없는 상황이 발생합니다.      하고 싶은건 컴퓨터에서 FTP든 토렌트들 데이터를 얼마나 사용하던지 상관없이   UHD 셋탑의 대역폭을 최소한 보장해줘서 TV는 끊기지 않도록 설정이 가능할까요?      설정을 찾아보니 대역폭 리미터 설정으로 특정값을 못넘어가게끔 제약은 가능하던데   이래버리면 평소에 TV를 보지 않더라도 컴퓨터의 대역폭에 제한을 걸어버리기 때문에   마치 평소 인터넷을 족쇄차고 사용해야 하는... 기가 라이트를 쓰는 의미가 확 줄어버리는데....      UHD 셋탑의 대역폭을 보장해 주며서, 그 남는 대역폭을 알아서 끌어다 사용하는 셋팅이 가능한건지   QoS 설정을 어떻게 해야할지 잘 몰라서 질문 드립니다.      컴퓨터로 뭘 할때마다, 와이파이님게 아~ 티비 끊기잖아~ 라고 안혼날 수 있게&nbsp;   ASUS AC68A 공유기 QoS 설정하는 방법 좀 조언 부탁 드립니다.   																			"
"156","누가 사준다면) 그랜저 vs K7","http://www.clien.net/service/board/park/14746545?od=T31&po=5&category=&groupCd=community","																										      되팔이 안되고 실제 타고다니는 용으로 누가 사준다면 어떤거 고르실건가요?      1. 그랜저                  VS         2. K7   https://www.kia.com/content/dam/kwcms/kr/ko/images/microsite/k7/pc/ms_k7_dm5.jpg"" class=""fr-fic fr-dii"">               저는 개인적으론 k7이 좋아 보이더군요.   그랜저는 실물로 보니 동글동글 ㅎㅎ   																			"
"157","일본 불매운동 기분좋은 소식 하나 보고 가세요..","http://www.clien.net/service/board/park/14746542?od=T31&po=5&category=&groupCd=community","																										      주말간 동숲으로 인해 서로 기분도 상하고 괜히 힘빠지고 짜증 날텐데            소니 강남 서비스센터가 문 닫는다고 하네요...      이러니 저러니 해도 불매운동은 착실하게 진행되고 있는 것 같습니다.         																			"
"158","라이젠 4500u 노트북.. 3400g 데스크탑의 성능 나올까요?","http://www.clien.net/service/board/kin/14746541?od=T31&po=5&category=&groupCd=community","																		 								      노트북 쿨러소리가 너무 시끄러워 조용한 데스크탑을 구매했습니다.   CPU와 시스템 팬 조용한걸 달아놓으니 소음은 아주 만족스럽군요.      CPU는 AMD 3400g에 램 16기가입니다.      QHD+FHD 모니터 듀얼로 사용하고&nbsp;   제가 하는 작업에는 차고 넘칠정도의 성능으로 아주 쾌적합니다..      근데, 오랫동안 노트북을 사용하다보니 다시 노트북이 &nbsp;갖고 싶네요.      4500u 나올떄까지 기다려보자 생각하고 있는데,      4500u 정도의 노트북이면 3400g 데스크탑 성능이 나와줄까요?   																			"
"159","oh japan man 난 니가 미워졌어","http://www.clien.net/service/board/park/14746540?od=T31&po=5&category=&groupCd=community","																										                            일본인의 귀에는 ""어젯밤엔""이 ""오 재팬맨"" 으로 들려 나름 일본에서 유명한 노래 입니다.         근데. 바로 이어지는 뒤의 가사는 몰랐나 봅니다...   																			"
"160","코로나 19에 영향 받는 로고들.jpg","http://www.clien.net/service/board/park/14746539?od=T31&po=5&category=&groupCd=community","																										            &nbsp; &nbsp;&nbsp;      																			"
"161","올림픽대로 무단횡단 참변..차에 치여 튕겼다 깔려 사망","http://www.clien.net/service/board/park/14746538?od=T31&po=5&category=&groupCd=community","																																																															         20대 남성이 올림픽대로에서 무단횡단을 하다 차량에 2차례 치여 사망한 사고가 발생했다.      23일 경찰과 소방당국에 따르면 전날 오후 9시17분께 서울 올림픽대로 동작구 지점 왕복 8차로를 무단횡단 하던 20대 후반 남성이 주행 중이던 차량 2대에 잇따라 치여 현장에서 사망했다.      이 남성은 잠실 방면으로 주행 중이던 차량에 치여 중앙분리대를 넘어 반대편 차로로 튕겨나갔고, 이어 반대 방향에서 달려오던 차량이 밟고 지나간 것으로 조사됐다.         https://news.v.daum.net/v/20200323102917205         아이고.. 이건 처음 친 차주 과실이 더 크게 나오려나요?   																			"
"162","3월23일 9시 기준 국가별 코로나19 발생 현황","http://www.clien.net/service/board/park/14746537?od=T31&po=5&category=&groupCd=community","																										         주말동안 미국도 급격하게 증가했네요~   출처: 네이버 지식백과   																			"
"163","탄핵정국때 두둠칫 했던 애들 많이 컸네요 ㄷㄷㄷ","http://www.clien.net/service/board/park/14746536?od=T31&po=5&category=&groupCd=community","																										                   GIF               2017년에 벌어진 일이라 3년 됐는데 엄마는 그대로인데 아빠만 좀 달라졌군요.. ㅠㅠ   보행기 타던 애는 엄청 컸구요 ㄷㄷㄷ   																			"
"164","하아... 오전에 고속버스 글 썼었습니다.","http://www.clien.net/service/board/park/14746535?od=T31&po=5&category=&groupCd=community","																																																															      제가 41번...   앞에 37번도 오늘 보니까 예매가 되어 있었다구요.      제가 버스 오자마자 앉아서 있으니까 뒤늦게 오신 그 분은 38번에 앉으시더군요.   아무래도 의자 젖히면 걸릴테니...      그런데 40번에 앉아 계시던분이랑 동행인지 40번 분은 39번에 앉아서 둘에서 이야기를 하시네요.      그것까진 뭐... 저도 이어폰끼고 노래 들으니 안 들려서 상관없었습니다.      헌데 언제쯤부턴가... 마스크를 벗고서 이야기를 하기 시작하네요.   휴게소에서 뭐 사온거 먹느라 그렇겠지 싶었지만... 다 먹고도 계속...      그렇게 둘이서 뭔 음악 이야기를 하는지 이어폰을 한쪽씩 끼우고 해드뱅잉을 하면서 신나게 이야기를 합니다...      그래요. 내 앞에서 그러는건 아니니까... 별 피해는 없을거라고 생각하고 차창밖을 보고 있는데...   갑자기 두 분 다 37,38번으로 자리 옮겨서 만담을 시작하시네요.   마스크없이...      둘이서 코로나 환자라 치더라도 저한텐 별 피해가 없겠죠? 전 마스크 끼고 있으니...    하아...   																			"
"165","봉쇄령 내려진 뉴욕시 거리 상황.tube","http://www.clien.net/service/board/park/14746534?od=T31&po=5&category=&groupCd=community","																										                미국 현지 시각 오늘 저녁부로 뉴욕의 봉쇄령인 PAUSE가 시행 됬습니다.&nbsp;   시행되기 직전 거리 영상이네요.&nbsp;   교통량이랑 유동인구는 확실히 급감한것 같습니다만 분위기 자체는 차분한 상태인것 같습니다.   																			"
"166","자유당의 착각.. 찬스인줄 알았는데.jpg","http://www.clien.net/service/board/park/14746533?od=T31&po=5&category=&groupCd=community","																																																																																																																																									      자유당 : 대략 난감....   &nbsp;   그건 그렇고.. 리얼미터..   &nbsp;   일간 지지율 변화가 너무 튀네요..   &nbsp;   들쑥 날쑥..   &nbsp;    /N<U+2622><U+FE0F>JAPAN <U+0001F631>      																			"
"167","커클랜드 오메가 너무크네요 ㅠ ㅠ","http://www.clien.net/service/board/park/14746532?od=T31&po=5&category=&groupCd=community","																										      싸길래 사서 먹긴하는데   약이 커서 먹고나면 식도가 꿀렁꿀렁하네요   얼라이브 비타민도 큰거같고   미국인들은 식도 크기가 틀린지 ㅋㅋ   약도 4개 남았는데 다 먹으면 다른걸 사야할듯요   																			"
"168","일본불매! \(ㅇㅍㅇ)/ 애니삭제로 시작하세요!","http://www.clien.net/service/board/park/14746531?od=T31&po=5&category=&groupCd=community","																										      우라나라에서 사용되는 영상은 대부분은 일본영상입니다.      싹다 지우세요 \(ㅇㅁㅇ)/ 일본영상 왜 봅니까         클린한 대한민국 \(ㅇㅍㅇ)/ 일본 불매의 시작 애니삭제!      여러분들과 함께 \(ㅇㅁㅇ)/ 클린하게 만들어 갑시다.   																			"
"169","사랑제일교회 예배서 즙짠 김문순대...외국 기자 '광기 장면 많아'","http://www.clien.net/service/board/park/14746530?od=T31&po=5&category=&groupCd=community","																										         사랑제일교회 예배에 참석한 김문수 전 경기도지사 (사진=유튜브 ‘너알아TV’ 캡처)         - 사진=영국 출신 프리랜서 기자 라파엘 라시드 트위터   사랑제일교회에서 예배 현장을 지켜본 영국 출신 프리랜서 기자 라파엘 라시드는 트위터를 통해 김 전 지사의 등장을 동영상으로 전하며 “보수 정치인과 김 전 지사는 종교모임에 대한 금지에도 교회 사역에 합류했다”고 했다.또 김 전 지사가 다른 교인들과 나란히 앉아 두 손을 들고 하늘을 바라보는 등의 모습을 공개하며 “오늘 예배를 강행하기로 한 서울의 같은 교회에서 완전한 광기의 장면이 더 많이 나온다. 대부분 사람은 나이가 특정하다”고 설명했다.               https://www.edaily.co.kr/news/read?newsId=02177926625706272&amp;mediaCodeNo=257      코로나19 확산 우려로 정부가 예배중단을 권고했음에도 전광훈(64·구속) 한국기독교총연합회(한기총) 목사가 이끄는 문재인하야범국민투쟁본부(범투본)은 지난 22일 서울 성북구 사랑제일교회에서 ‘주일 연합예배’를 강행했다.해당 예배에는 김문수 전 경기도지사가 참석해 눈길을 끌었다.마스크를 벗고 앞에 나서 마이크를 잡은 그는 고개를 숙이며 한참 말문을 열지 못하다 “하나님께서 우리와 함께하심을, (전광훈) 목사님께서 우리와 함께하심을 믿는다”며 “전 목사님이 계셨더라면 우리는 이렇게 아프지 않았을 것이다. 지금 이 자리에 오셔야 할 분은 제가 아니라 전 목사님이고, 우리는 그분을 기다린다”고 말했다.      (후략)         ------   그 와중에 국격이 상승 중 이네요 ㄷㄷ         																			"
"170","우리은행 추천직원","http://www.clien.net/service/board/park/14746529?od=T31&po=5&category=&groupCd=community","																										      우리은행 앱 설치중에 추천직원란이 있네요~댓글 남겨주시면 등록해드릴게요~   																			"
"171","[속보] 수원시 코로나19 확진자 1명 추가… 프랑스 다녀온 곡성동 거주 20대","http://www.clien.net/service/board/park/14746528?od=T31&po=5&category=&groupCd=community","																																																															      &nbsp; &nbsp;&nbsp;   																			"
"172","동숲 논란을 간단하게 정리해보려는 뻘글입니다...","http://www.clien.net/service/board/park/14746527?od=T31&po=5&category=&groupCd=community","																										      노재팬중이신 콘솔게이머들은      사서 즐겨도 됩니다      눈치만 챙기면 됩니다...      눈치없이 몇년전 모공처럼 행동하시면      예스재팬하는 사람으로 보입니다      네 모공 변했어요...   																			"
"173","총선 전 복습","http://www.clien.net/service/board/park/14746526?od=T31&po=5&category=&groupCd=community","																										      FTA 날치기 의원                              																			"
"174","일본불매! \(ㅇㅍㅇ)/ 야동삭제로 시작하세요!","http://www.clien.net/service/board/park/14746525?od=T31&po=5&category=&groupCd=community","																										      우라나라에서 사용되는 영상은 대부분은 일본영상입니다.      싹다 지우세요 \(ㅇㅁㅇ)/ 일본영상 왜 봅니까         클린한 대한민국 \(ㅇㅍㅇ)/ 일본 불매의 시작 야동삭제!      여러분들과 함께 \(ㅇㅁㅇ)/ 클린하게 만들어 갑시다.   																			"
"175","두바이 정부의 코로나 권고사항을 조롱한 유럽인 체포","http://www.clien.net/service/board/park/14746523?od=T31&po=5&category=&groupCd=community","																										      UAE 정부는 코로나 확산을 방지하기 위해 사람이 많이 모이는 공공장소 폐쇄조치 단행.   여기에는 해수욕장, 나이트클럽, 관광명소 등이 포함되어 있습니다.      한 유럽청년이 온라인에 해변에 설치한 안내표지판 영상을 올리며   이런 정부의 조치에 대한 조롱을 했나 봅니다.&nbsp;      지역 경찰이 바로 체포했다고 하네요.&nbsp;               																			"
"176","김종배의 시선집중 총선 천기누설 2탄","http://www.clien.net/service/board/park/14746522?od=T31&po=5&category=&groupCd=community","																										      2탄             2탄 플러스                1탄 내용도 매우 훌륭하니 못보신 분들은 꼭 보시길 바랍니다.      1탄          																			"
"177","부대끼러 가는 곳.jpg","http://www.clien.net/service/board/park/14746517?od=T31&po=5&category=&groupCd=community","																																																															      전 클럽 안(못)가봐서 몰라요....   오히려 거리 두고 차분히 놀면 좋은 거 아닌가요?&nbsp;   제가 아싸라. 이런 문화를 잘 몰라요 ㅠ   																			"
"178","남자라면 호드라 들었는데 말입니다.","http://www.clien.net/service/board/park/14746516?od=T31&po=5&category=&groupCd=community","																										      실바나스의 최근 근황은 호드와 관련이 없음을 알려드립니다. =3   																			"
"179","와 진짜 보이콧 할줄은","http://www.clien.net/service/board/park/14746515?od=T31&po=5&category=&groupCd=community","																										      캐나다에 이어 호주 영국도 살살 눈치 보고있고 이태리도 사실상 보이콧 할것 같고   그냥 망했네요 트럼프도 연기 운운하는것 보니 이런분위기면 안할것 같고   우리도 손절하고 중국 동남아 몇개국끼리 하는게 나을듯&nbsp;   사실상 취소네요 연기는 못할테고&nbsp;   																			"
"180","마스크를 종일 쓰니 안좋은점... 중에 하나...","http://www.clien.net/service/board/park/14746514?od=T31&po=5&category=&groupCd=community","																										      저는 면도를 일주일에 한번 할까말까한 사람인데....   코로나 이후로 일주일에 한두번은 해야하네용..ㅜㅜ   싸구려 면도기 사면 반년은 썼는데 자주하다보니 따꼼거려서 좋은거 사보려고 인터넷 뒤적거리고 있습니다...   생전 천원넘는 면도기를 사야할 날이 오다닝...   																			"
"181","엄청 박쎄 보이는 스커트 ㅊㅈ.gif","http://www.clien.net/service/board/park/14746513?od=T31&po=6&category=&groupCd=community","																																																																																																				GIF																																	      전 불가능 ㅎㄸ   																			"
"182","명랑 핫도그 최애메뉴!","http://www.clien.net/service/board/park/14746511?od=T31&po=6&category=&groupCd=community","																										         추천   1. 따따블   2. 통 모짜   3. 모짜체다      비추   숯불갈비맛      근데 명랑핫도그 메뉴 많아 보였는데   이렇게 놓고 보니까 그렇게 많지도 않군요.      고구마(감자) 통 모짜 이건 고구마 좋아해서 되게 기대했는데   뭔가 호불호 있는 맛이네요.      점심 맛나게 드세용~!         																			"
"183","안철수 근황..... n번장 이슈 승차하심....","http://www.clien.net/service/board/park/14746510?od=T31&po=6&category=&groupCd=community","																										      http://news.naver.com/main/read.nhn?mode=LSD&amp;mid=sec&amp;sid1=001&amp;oid=001&amp;aid=0011491050      ㄴ이버에 ㅇ철수 이슈가 겹쳐서 불편한 기사긴 합니다만.....      아래 댓글이 왜 저렇게 되었는지 모르겠네요. 안철수 지지자가 저렇게 많았나요?            ------------------------------------------------------------   중략   ------------------------------------------------------------                  이상하네요..... 이상하다...   																			"
"184","무능한 정부가 수입하고 신천지가 퍼뜨린 코로나 사태 라는 말","http://www.clien.net/service/board/park/14746509?od=T31&po=6&category=&groupCd=community","																										      ""무능한 정부가 수입하고 신천지가 유통한 코로나 사태"" 때문에 2주 더 쉽니다      이번에 한 요가학원에서 회원들에게 보낸 DM 입니다.      그런데 체육계(?) 쪽에 일하는 사람들은 대부분 이렇게 생각하는 거 같아요.   제가 다니던 헬스장 관장님도 인스타 열심히 하고 나름 헬스업계에서 유명한 분인데,   2월달엔 중국입국 안막는다고 문재앙 개새끼니 어쩌구 저쩌구 SNS에 몇번 올리더니   지금도 정부가 초기대응 잘못해서 키워놓고   2주 쉬라는 것도 정부가 일하는 척하면서 총선용 퍼포먼스 하는 거라고 막 글 올리네요.      개인적으로 굉장히 좋게 봤던 분인데   정나미가 뚝 떨어져서 보기도 싫으네요.      근데 동조하는 댓글도 많이 달려서 더 화가나요.      지금 헬스장만 힘든거 아니고 모두가 힘든건데... 그리고 지금 2주 잘 극복해서 빨리 종식시켜야 모두가 사는건데   왜 저러는지 모르겠네요.      너무 화가납니다.      																			"
"185","탈모가 뭐 어때서 그래요","http://www.clien.net/service/board/park/14746508?od=T31&po=6&category=&groupCd=community","																																																																																																																																									      맨날 하는 소리지만   잘생기면 됩니다 ㅇㅇ   																			"
